review_id,user_id,product_id,rating,review_text,review_date
1,70,37,4.8,Small former end family surface like term on want author threat matter test high fear approach.,2025-02-27
2,88,25,4.5,Case customer important notice trade leader first resource single maintain piece.,2024-11-12
3,87,16,4.1,Finish around later decide similar office citizen size sister can its investment.,2025-02-01
4,54,38,3.2,Whole himself also current health add focus street course quality phone eat really general can himself open.,2025-01-27
5,38,43,5.0,Assume animal way lay minute model its rather card you majority seek.,2024-10-26
6,74,49,4.0,Way truth idea direction road capital safe operation college hand practice also.,2025-02-28
7,80,23,3.3,Side perhaps order answer blue structure answer break know buy education reduce day.,2025-06-10
8,75,14,3.7,Act inside big minute performance red industry together memory pay executive size marriage participant sing story win group important civil nature.,2024-11-18
9,32,6,4.3,Read lose doctor actually become book off management we single avoid rich.,2025-05-07
10,45,25,2.8,Popular lead with enough anyone spend them system growth quality international break surface.,2025-01-21
11,61,23,4.0,Act catch positive forget thus western environmental run head.,2024-12-17
12,70,43,3.7,Consumer husband while even history surface son power someone both receive around wall city indeed.,2024-11-21
13,88,12,5.0,Lot notice just particularly single particularly television they road through low maintain thought key as pressure actually than modern season.,2025-01-12
14,97,13,2.5,Difference what their mind read peace item risk loss professional political chance step throughout party activity various measure light.,2024-10-23
15,53,36,4.8,Thank avoid man drive wife anyone development poor idea dog learn soon large task language budget market president.,2024-09-16
16,51,39,5.0,Idea along near stay social white point three none pressure.,2025-05-30
17,76,34,2.5,Wear guy approach development lawyer nice people list price respond box service develop game stop who factor.,2025-04-12
18,56,6,2.6,Hear blood to manage state score important effect cultural building system democratic station course full serious another plan.,2024-09-27
19,27,38,5.0,But through leader operation mean white above save network item one under sit travel reality community spring billion price paper.,2024-12-21
20,38,50,3.3,Mean his woman trouble several event white wife laugh card include record security federal reduce.,2024-10-27
21,62,40,5.0,Republican very plan cut person fact generation public wonder practice when mean reason follow break.,2024-10-17
22,18,8,2.6,No old wall report purpose throw move there institution actually blood herself apply argue environment.,2025-07-31
23,64,8,4.1,Worker raise chair artist six daughter must grow laugh pattern push no.,2025-03-03
24,77,40,4.0,Score night down six sometimes explain professor unit hold what wish fine need.,2025-03-01
25,30,33,3.8,Season data than team kitchen difficult plant remember happy.,2025-02-13
26,49,34,4.4,National owner simply who family concern radio cost community message help investment news candidate once effort form report choice child.,2024-11-09
27,41,44,4.4,Others similar personal successful feeling so nearly authority remain moment whatever minute skill city myself.,2025-06-26
28,13,15,3.9,Begin determine degree forward guess despite sell most you statement wonder across protect knowledge toward party.,2025-01-15
29,34,36,3.2,During always those high someone box either rich agency might side method meet main fast prepare fly bank benefit will.,2024-11-28
30,100,35,4.8,Mouth phone decision picture defense rate structure day stock these scientist itself stage authority rather agency response also available.,2025-08-14
31,94,46,4.5,Some newspaper offer direction else hold picture item admit pull movement political.,2024-12-27
32,25,22,4.1,As second animal summer group me face rate paper example unit high state air choose detail section someone support far.,2025-04-26
33,66,23,4.5,Fear thought whole term possible whatever action themselves center among of.,2024-11-03
34,100,40,4.6,Mr water fight security tough gas include position mention claim determine strong create consider son system.,2025-07-07
35,18,45,3.4,Leave near fact attack better rise maintain former campaign pretty beyond people too fish late pattern figure once not.,2025-07-09
36,5,22,4.4,Space when collection finish size Republican political everybody growth quickly former lose knowledge simple main.,2025-05-09
37,19,5,3.6,Compare parent success teach cause Mrs enjoy though baby away.,2025-04-29
38,42,31,4.6,Support place spend often shoulder defense already end thus.,2025-08-21
39,18,13,3.8,Line simple hand development sign run fact let member however maybe production summer southern pass coach method land condition.,2024-11-08
40,32,28,4.5,Process whose save low grow despite maintain as hard amount deal traditional guess like lawyer another wonder food region.,2025-04-16
41,21,20,3.7,Plant event score official now heavy her onto together back edge win development image stage generation society thought.,2025-04-06
42,10,33,4.5,Maybe catch close baby poor deep cost gun response.,2025-08-02
43,37,16,3.2,Produce increase form box push look opportunity positive improve during campaign.,2024-12-02
44,49,29,4.0,Claim picture always occur argue election conference when out nor affect rest product exist beat last yeah test color store.,2024-10-07
45,86,23,4.8,Central old should perhaps member cold rate two others attention her car admit mission training range step painting concern top.,2025-02-10
46,13,24,4.4,Although six me brother lot candidate owner still to simple power miss have analysis morning director sort smile high open.,2025-08-02
47,55,34,4.2,Best care local discussion teacher exist theory impact country remember smile official brother according pressure reach firm gun choice.,2025-03-25
48,17,7,5.0,Effect talk interest hand every quite sense including six lot have never effect fill general relationship save talk process security.,2025-03-12
49,9,38,4.8,Situation we beyond meet skill song pass range appear home player source statement likely outside because enjoy.,2025-08-04
50,88,37,4.7,Bag also his worker pass minute represent our watch star policy keep cut prevent sound experience.,2024-11-27
51,44,4,4.5,Six member recognize past purpose growth pretty wish beautiful.,2025-04-21
52,78,34,4.6,Sister good house only military say attention bed expect stop trip give white everybody.,2025-03-06
53,46,42,5.0,White lawyer identify above company media next me future bring message election Mrs soldier economic kind help low during fund.,2025-07-26
54,8,22,3.7,Race to television loss election him small detail red son include good movie red enjoy expert human.,2025-03-02
55,37,5,4.8,Away use live government thus especially water raise travel material current save their deal dark.,2024-12-21
56,19,50,4.3,Student green single build bad what manage according tax when summer he firm.,2024-09-09
57,63,42,3.7,Than make worker trouble exactly develop office approach son long must maybe hour rather company with recently least ready.,2025-06-14
58,92,23,3.9,Purpose here beyond gun technology cost enjoy especially when.,2025-02-17
59,46,15,4.2,Hand material decision red head take evidence conference capital office direction between establish dog it.,2025-06-16
60,94,31,3.3,Cultural son school list act instead care throw piece move firm main economy teach answer between.,2025-08-08
61,71,9,4.7,Art sport live picture last free guess night use election after building.,2024-12-08
62,26,43,3.9,Current office power company sister great pull maintain say threat high expert place certain cold space front piece occur support.,2024-12-09
63,46,25,4.1,Bad gas finish president report painting house thought sit voice.,2025-01-09
64,46,25,5.0,Minute late cold take by doctor edge season see decision however believe view list approach side model you billion peace.,2025-02-19
65,75,49,4.1,Pressure those finally easy exist phone capital stuff agreement professional.,2025-04-17
66,14,21,5.0,Ten level that various nature career way much opportunity lead see theory itself policy move.,2024-11-29
67,85,9,3.6,Loss dinner become film include choose action model serve carry expert movement reach man sense.,2025-08-16
68,63,48,3.1,Across involve fall discuss account health in night house clear say hope her enjoy.,2025-08-30
69,72,38,3.8,Personal might son party really even possible mother especially could attention carry book lay laugh red man.,2025-04-21
70,3,22,1.7,Affect anyone movement control bill especially resource road do character management game find son your.,2024-10-31
71,28,43,4.7,Recent all bag seek certainly entire hotel myself consider time economic high actually window research his window.,2025-08-24
72,29,23,3.2,Scene almost leave side miss word list race fine follow pick among visit.,2025-04-14
73,87,49,3.5,Business loss federal growth appear project wind door its address some once how during why ok real read.,2025-08-18
74,18,4,4.6,He become citizen before peace us young personal art popular red.,2024-09-05
75,35,29,4.1,Call discussion word small series south just cover ready group.,2025-02-13
76,77,15,3.6,Economy always religious next my majority note myself food life test.,2024-09-21
77,76,1,2.4,Trial never attention choice fast enjoy happen a point here control affect task simply draw return probably much hold model.,2024-09-19
78,47,30,5.0,She child executive important focus benefit probably analysis visit condition all blood court all politics home majority perhaps.,2025-03-05
79,5,29,4.6,Eight hand paper audience us decade man threat bag song art newspaper voice indeed hard remain statement entire American audience.,2025-06-15
80,75,20,5.0,Back democratic mind big discuss history cover prevent now way next newspaper second short.,2025-06-29
81,59,33,3.5,Group learn professor third coach Congress husband front citizen your kitchen good firm yard foot he share issue rise.,2025-03-18
82,75,41,2.8,Drive nation heart nearly season growth laugh where a alone expect administration career three according worker Democrat fire sign wall.,2024-09-17
83,59,44,4.8,Try memory number occur behind leave choose enter threat economic eight feel now notice.,2025-02-16
84,47,36,3.8,Safe rich society common stay ready office traditional organization feel room office bad.,2025-03-29
85,95,22,4.5,Two free they its us building side section support up.,2025-02-04
86,95,13,5.0,Him fight American music change maybe determine anything rule hotel knowledge organization measure develop face hour car bar number any human.,2025-03-09
87,13,7,4.3,Huge its recently seven lose cup house number night young.,2025-07-15
88,78,8,4.1,East author since food under become public interest give fly order agency fight write pattern wrong kind certainly and.,2025-07-10
89,89,28,4.2,Current health serious table both approach we unit than star add really born.,2025-06-01
90,33,45,2.7,Likely forward science deep national seek nature performance yeah reason property heavy town money eight art customer.,2025-07-19
91,97,43,4.9,Even let war at produce production tree growth blue fall third hit woman meet report tough machine others because current.,2024-10-12
92,62,9,4.9,Night Republican always two figure majority season adult range green few you without every artist election hit.,2025-02-26
93,79,25,4.4,Want we difficult game hotel case role minute question.,2025-03-15
94,16,16,2.8,Rather individual of interview fine painting last capital present ok range dark catch read together travel involve training show prevent north.,2024-12-06
95,44,10,3.9,Fish newspaper we brother fish they risk she they increase in kitchen.,2024-10-06
96,58,11,5.0,Charge could capital ago worry pay paper partner others discuss ago bag sister care.,2025-04-08
97,6,31,3.5,Light power contain hold listen clearly difficult impact why understand wear development provide dark daughter computer western keep pay reach.,2025-06-23
98,89,12,4.9,Thought into simply part station result hour voice occur movie political region although body lead there there.,2024-09-08
99,15,31,4.0,Million how same newspaper might piece any fact huge fight still leave institution.,2025-05-31
100,4,14,4.6,Try ready tough less position bed may conference one thus national hotel food agent law to time think bed food.,2025-06-15
101,56,44,3.7,Responsibility but box last guy model himself social memory wear her herself.,2025-02-08
102,64,32,4.1,Treatment not process change than condition Republican information finally shoulder land phone.,2024-11-27
103,68,50,4.3,Together whether about she activity marriage material space part management describe.,2024-10-25
104,94,17,3.1,Law kind over according think everything pick star debate continue area give certainly allow official owner former because.,2025-01-21
105,34,35,4.2,Indicate condition public particularly reality organization skin concern lay often.,2024-12-27
106,91,1,1.8,Behavior federal happy her attack interview nearly fall care.,2024-12-05
107,95,29,3.5,Forget including decide decade around number without more because right painting small religious interview.,2025-05-13
108,56,4,4.4,Employee offer perhaps until pass market role marriage space this discussion fact cover brother let.,2024-10-09
109,32,23,4.9,Scene debate past increase animal glass south defense political real effort.,2024-09-10
110,9,28,4.4,Film media food accept rate game right pattern ahead compare.,2025-03-09
111,63,16,2.9,Street two look listen along career choice leave tend time leg sport until argue minute.,2025-05-21
112,72,12,4.8,Right firm movie decade rate son thousand government wide exactly all worker phone success number hope organization ten seem.,2024-12-31
113,78,21,3.1,Report even beautiful theory he stop few modern company hear also dark begin media sometimes.,2024-11-05
114,33,45,4.5,Child future low them financial force show better word might yeah day already hold ten break financial analysis.,2025-06-04
115,87,17,3.1,The four threat billion she seat against serve police decide customer expert mother significant provide evening church boy when nice.,2025-03-01
116,21,40,3.4,Deal go five center region exist each author party full.,2025-08-03
117,55,13,3.2,Anything ahead tough anyone himself beat hot relate through picture real knowledge green forward cup serve speak.,2025-04-13
118,76,32,4.1,Wind sense letter capital spend turn life lay range report.,2025-06-21
119,57,37,3.8,Like water century time election guy contain true form team foot maintain assume both long suffer executive.,2025-04-18
120,2,50,4.4,Page camera bill stage someone for power society mouth husband including per nature wind himself.,2024-09-13
121,13,15,4.0,Decade really issue woman note garden reason community prove school Republican student boy other foot.,2025-02-27
122,4,12,2.8,State computer what attorney board sport side her management produce.,2025-03-03
123,84,49,4.2,Design catch oil sense special serious produce laugh factor past.,2025-06-30
124,50,15,2.6,Crime race first now tree fight wall itself work general become account worry identify camera family hard.,2024-10-27
125,48,34,3.3,Whose a nice without body executive all it opportunity personal Republican image itself deep community cause new successful growth.,2025-08-09
126,78,6,3.7,Child young prove care author administration return main join wrong be politics indeed lay smile page.,2025-06-04
127,30,17,3.7,Perhaps lawyer interest star his difficult interesting account marriage room Republican especially unit office almost also low.,2025-02-08
128,29,48,2.7,Both loss real center rule worker worker single let back three because line score whether back.,2024-11-14
129,8,49,5.0,Something fine apply gas sing light mention light safe inside whether sometimes eye along type see risk nor article.,2025-07-07
130,12,20,5.0,Official of prevent factor say agree machine camera baby six edge past every either scientist page travel school.,2025-08-08
131,41,9,5.0,Have compare site door Congress month almost worker whose other start study sell include himself produce rise.,2025-01-25
132,26,5,4.9,Decision same generation politics sense break cold human feeling second sell mouth.,2025-05-05
133,50,23,3.7,Raise hope enjoy most itself eye something high firm morning what best most government such particular.,2025-03-03
134,2,33,3.7,Friend environment better pressure hospital significant see same open crime front real conference natural.,2025-06-04
135,55,38,3.6,Story activity best billion land detail exist cover agency.,2025-05-07
136,56,14,5.0,Arm order thus describe outside business when beat painting heavy.,2024-09-04
137,14,17,3.9,Sort continue book contain far produce away law yet show realize property show either sit everyone artist home you.,2025-08-04
138,6,19,5.0,Western enough key man up particular condition man century shoulder despite poor tree.,2025-05-05
139,95,33,5.0,Billion authority number economy knowledge to chance policy usually professor entire record toward.,2024-10-01
140,81,1,4.2,About remain side long identify road speech audience difficult his ready sister building movement yard four field area young.,2025-01-31
141,89,13,2.8,Half table future subject set face data never whose produce.,2025-08-16
142,61,46,3.9,Receive to piece grow be plan same cause cover rest or majority as music.,2025-05-30
143,96,27,4.1,Matter who speech whom administration fund front return if deep president mission vote thank.,2025-01-11
144,12,6,5.0,Chance often under already center president likely truth animal red candidate common anyone film soldier lay color opportunity stand.,2025-03-29
145,13,6,4.0,Box organization past as dark front structure scene I building.,2024-09-16
146,19,33,3.0,National focus who degree animal community as event serious collection have close during old card social place heavy citizen.,2024-12-28
147,44,30,4.8,Ball account unit religious order exist really society live camera central even late dream company reality other response.,2025-02-16
148,89,46,3.8,Wear physical site girl above dog brother morning believe gun seven music despite show process everybody create someone rate why.,2025-06-23
149,95,35,2.0,Marriage civil two approach hair decide edge pattern three law bit appear Mr citizen ahead method audience dog.,2024-12-17
150,59,23,4.3,Or for cup quality for single for better scene thank heart determine likely machine three certain until.,2025-06-02
